{
  "schemaVersion": 1,
  "id": "implementation-component",
  "title": "Implementation inside a component",
  "journal": "implementation",
  "change": "new",
  "entry": "work",
  "maxTransitions": 100,
  "roles": [
    "architect",
    "developer",
    "reviewer"
  ],
  "nodes": {
    "work": {
      "kind": "component",
      "params": {
        "ref": "work"
      },
      "ends": {
        "next": "verify",
        "failed": "failed"
      }
    },
    "done": {
      "kind": "end",
      "params": {
        "outcome": "success",
        "requiresVerified": true
      },
      "ends": {}
    },
    "failed": {
      "kind": "end",
      "params": {
        "outcome": "failure"
      },
      "ends": {}
    },
    "verify": {
      "kind": "verify",
      "params": {
        "commands": "configured"
      },
      "ends": {
        "pass": "done",
        "fail": "failed",
        "failed": "failed"
      }
    }
  },
  "components": {
    "work": {
      "entry": "implement",
      "nodes": {
        "implement": {
          "kind": "implementation",
          "params": {
            "approvalBeforeArchive": false
          },
          "ends": {
            "next": "done",
            "rejected": "failed",
            "failed": "failed"
          }
        },
        "done": {
          "kind": "end",
          "params": {
            "outcome": "success",
            "exit": "next"
          },
          "ends": {}
        },
        "failed": {
          "kind": "end",
          "params": {
            "outcome": "failure",
            "exit": "failed"
          },
          "ends": {}
        }
      }
    }
  },
  "delivery": {
    "requiresVerified": true
  },
  "version": "3ebd003720588211080fe8515e19def7fd7516ff165765162d360839ca015e53"
}
