{
  "schemaVersion": 1,
  "id": "freestyle",
  "title": "Freestyle",
  "journal": "ledger-only",
  "change": "none",
  "entry": "work",
  "maxTransitions": 100,
  "roles": [],
  "nodes": {
    "work": {
      "kind": "prompt",
      "params": {
        "engine": {
          "provider": "fixture"
        },
        "text": "Inspect the project and report your findings.",
        "access": "read",
        "sentinel": "blocked"
      },
      "ends": {
        "next": "done",
        "failed": "failed",
        "blocked": "failed"
      }
    },
    "done": {
      "kind": "end",
      "params": {
        "outcome": "success"
      },
      "ends": {}
    },
    "failed": {
      "kind": "end",
      "params": {
        "outcome": "failure"
      },
      "ends": {}
    }
  },
  "version": "9b23d4bd46222996bed3d7485bafc06694add66ef7986825e04f9dc9da9bc211"
}
